問題発見日,記入者,ユニットコード,図品番,不具合内容,対策内容,発生タイミング,項目,設計回答日,設計回答者,完了予定日,図面修正完了日,対策品集合日,対策完了日,blank,SEで見切るべき,SEで見れない,設計未対応,発生タイミング,項目,サイレン,組付課名,管理番号,製作番号,基盤,設備名,日付差,対策完了日,担当組付課,機種コード,担当設計室
2025/4/7,藤田,,,"厚み検査装置、ラミ減圧非常停止解除で
動力が復帰するがよいか？",減圧非常停止解除で動力供給されるが指令は切れている為プッシュプルは動き出さないので問題ないです,いじわる異常処置確認,仕様未確定,2025/4/25,片山,2025/4/25,,,2025/4/25,,,,,いじわる異常処置確認,仕様未確定,,第1組付課,５FB1920,21045,KAMB0022,ラミ減圧封止,15,2025/4/25,QEE33,ZL1523,QE760
2025/4/7,藤田,,,"前後工程電源切り状態、自工程安全PLC工程間
通信異常発生中にて
前後工程を電源を入れ、自工程の異常リセットを
したとき、再度通信異常が発報する？","回路修正しました。
NanoSafety立ち上がり完了まで
異常監視を遅延←革新共通",いじわる異常処置確認,設計不良,,,,,,2025/5/9,,,,,いじわる異常処置確認,設計不良,,第1組付課,５FB1920,21045,KAMB0022,ラミ減圧封止,70,2025/7/11,QEE33,ZL1523,QE760
2025/4/7,辻本EX,,,後工程ガイドローラ（補助ローラ）ハードストッパに当たる前に自工程にあたる,後工程にて対応,造り込み,検討不足,2025/5/9,荒巻,,,,,,,,,造り込み,検討不足,中,第1組付課,５FB1920,21045,KAMB0022,ラミ減圧封止,70,2025/7/11,QEE33,ZL1523,QE760
2025/4/7,辻本EX,,,自工程搬出側から後工程コンベア内に侵入できる,後工程側でカバー追加,造り込み,検討不足,,,2025/5/7,,,2025/5/7,,,,,造り込み,検討不足,,第1組付課,５FB1920,21045,KAMB0022,ラミ減圧封止,23,2025/5/7,QEE33,ZL1523,QE760
2025/4/7,藤田,,,"厚み検査装置と全く同じ動作をする軸で
ﾌﾟｯｼｭﾌﾟﾙ上下、位置決め、ストッパ､搬送ｺﾝﾍﾞｱ
名称がラミ減と違う。ASS修正？","実機はどちらも変更しません
次機で名称合うように後工程と協議します",造り込み,検討不足,,,,,,2025/5/7,,,,,造り込み,検討不足,,第1組付課,５FB1920,21045,KAMB0022,ラミ減圧封止,70,2025/7/11,QEE33,ZL1523,QE760
2025/4/15,辻本EX,,,大気開放バルブ弁体Oリング交換時バルブ全体を取り外さないと交換できない,"バルブ取付角度変更→
現物に合わせて3Dモデル修正してください",造り込み,検討不足,2025/5/9,岩本,2025/6/2,2025/6/5,,2025/6/11,,,,,造り込み,検討不足,,第1組付課,５FB1920,21045,KAMB0022,ラミ減圧封止,64,2025/7/11,QEE33,ZL1523,QE760
2025/4/15,辻本EX,,,真空引きバルブ・大気開放バルブ　内部で金属が当たり発塵しているが問題ないか？,"確認します
真空引き側問題なし、大気開放ｇはバルブ変更",造り込み,懸念事項,2025/5/9,荒巻,2025/6/30,,,2025/7/1,,,,,造り込み,懸念事項,,第1組付課,５FB1920,21045,KAMB0022,ラミ減圧封止,55,2025/6/30,QEE33,ZL1523,QE760
2025/4/21,辻本EX,,,1stにパレット入ってこなくても後工程にパレットが出ていく,"１ｓｔにパレットが入ってくる条件は前工程搬出可と次工程搬入可が揃うことなので、こことは関係なく自工程搬出可と後工程搬入可が揃ってるなら出て行ってOKです。
現状でOK",造り込み,,,荒巻,2025/4/25,,,2025/4/25,,,,,造り込み,,,第1組付課,５FB1920,21045,KAMB0022,ラミ減圧封止,5,2025/4/25,QEE33,ZL1523,QE760
2025/4/21,辻本EX,,,本来標準手持ちは1stだが連続切で1stで止まらずチャンバ内で加工完了して連続切れる,"連続切後に入ってきたワークは1stで止まる必要があるが、既に1stにいる状態で連続切りをした＆チャンバー内が空いてるなら移動して加工、フルワークまでもっていって止まるのが正解。この時サイクルはワークを引き込むまでになってるので前工程が搬出可なら１ｓｔにもワークは引き込む
現状でOK",造り込み,,,荒巻,2025/4/25,,,2025/4/25,,,,,造り込み,,,第1組付課,５FB1920,21045,KAMB0022,ラミ減圧封止,5,2025/4/25,QEE33,ZL1523,QE760
2025/4/21,辻本EX,,,各個サイクルでQR読み取らない,回路修正,造り込み,ポカミス,,,,,,2025/4/21,,,,,造り込み,ポカミス,,第1組付課,５FB1920,21045,KAMB0022,ラミ減圧封止,60,2025/7/11,QEE33,ZL1523,QE760
2025/5/6,辻本EX,,,操作盤全完了ランプ点灯してるのに加工完了ランプ消灯している（全完了内の加工完了条件と加工完了単体の条件が違う）,回路修正,造り込み,ポカミス,,,,,,2025/5/15,,,,,造り込み,ポカミス,,第1組付課,５FB1920,21045,KAMB0022,ラミ減圧封止,49,2025/7/11,QEE33,ZL1523,QE760
2025/4/15,辻本EX,,,真空引きバルブ弁体Oリング交換時バルブ全体を取り外さないと交換できない,"現状のバルブ使い方が間違っててOリングが切れやすくなってるのでそちらを是正します
交換性は機器仕様なので変更なし",造り込み,検討不足,,荒巻,2025/6/30,,,2025/7/1,,,,,造り込み,検討不足,,第1組付課,５FB1920,21045,KAMB0022,ラミ減圧封止,55,2025/6/30,QEE33,ZL1523,QE760
2025/5/8,竹里EX,,,"チャンバー内のパレット位置決めﾀﾞｲﾔﾋﾟﾝ生材のため
傷が入り、パレットの引っ掛かりが発生",焼き入れ品で再手配します,造り込み,ポカミス,2025/5/9,荒巻,2025/9/30,,,,,,,,造り込み,ポカミス,中,第1組付課,５FB1920,21045,KAMB0022,ラミ減圧封止,104,2025/9/30,QEE33,ZL1523,QE760
2025/5/8,辻本EX,VGK357,033K～036K,取付用の後入れナットと取付ボルト手配されていない,手配願います,,,2025/5/9,荒巻,2025/5/18,,,2025/5/22,,,,,,,,第1組付課,５FB1920,21045,KAMB0022,ラミ減圧封止,7,2025/5/18,QEE33,ZL1523,QE760
2025/5/9,辻本EX,PAG182,32,調整時ぶつけた　インローが座屈している,"再製作願います
納期確認中（岩本さん250515）",サーボ動作調整,破損,2025/5/9,荒巻,2025/6/3,,2025/6/2,2025/6/11,,,,,サーボ動作調整,破損,,第1組付課,５FB1920,21045,KAMB0022,ラミ減圧封止,18,2025/6/3,QEE33,ZL1523,QE760
2025/5/27,辻本EX,,,基準短辺下流側サーボシリンダ引きずりトルクが大きい？,サーボシリンダをすこしずつ分解し、原因を特定する。⇒実証では不要。(対応できれば行う),造り込み,懸念事項,2025/6/2,岩本,2025/6/30,,,2025/6/30,,,,,造り込み,懸念事項,,第1組付課,５FB1920,21045,KAMB0022,ラミ減圧封止,25,2025/6/30,QEE33,ZL1523,QE760
2025/5/28,辻本EX,,,真空引き中に非常停止すると加圧拘束端が外れるので非常停止で真空大気開放した方が良い気がしてきましたが如何でしょう？,"確認します。
真空引き中(溶着なし)では問題なし",造り込み,懸念事項,2025/6/2,岩本,2025/6/30,,,2025/6/30,,,,,造り込み,懸念事項,,第1組付課,５FB1920,21045,KAMB0022,ラミ減圧封止,24,2025/6/30,QEE33,ZL1523,QE760
2025/5/28,辻本EX,,,真空バルブポンプシャッタ閉じ端を原位置に変更したので機器符号を振り直し,銘板変更時に確認します。,造り込み,検討不足,2025/6/2,岩本,2025/6/6,,,2025/6/4,,,,,造り込み,検討不足,,第1組付課,５FB1920,21045,KAMB0022,ラミ減圧封止,8,2025/6/6,QEE33,ZL1523,QE760
2025/6/2,辻本EX,,,チャンバ入口密着面にうねりがあり平面でない,"Oリング密着面でしょうか。確認します。
現状部品交換が現実的でないため、
Oリング交換(No.158)で対応。",造り込み,設備品質,2025/6/5,岩本,2025/6/30,,,2025/7/1,,,,,造り込み,設備品質,,第1組付課,５FB1920,21045,KAMB0022,ラミ減圧封止,21,2025/6/30,QEE33,ZL1523,QE760
2025/6/3,辻本EX,,,チャンバ入口扉Oリング破裂？している,Oリングを手配します。,造り込み,破損,2025/6/5,岩本,2025/9/30,,,,,,,,造り込み,破損,中,第1組付課,５FB1920,21045,KAMB0022,ラミ減圧封止,86,2025/9/30,QEE33,ZL1523,QE760
2025/6/3,辻本EX,,,チャンバ扉入口Oリング配線ラックのため交換スペースがない,ラックのサイズ変更できないか、配線場所変更できないか、確認します。,造り込み,検討不足,2025/6/5,岩本,2025/9/30,,,,,,,,造り込み,検討不足,中,第1組付課,５FB1920,21045,KAMB0022,ラミ減圧封止,86,2025/9/30,QEE33,ZL1523,QE760
2000/4/1,田中,10_巻出,VGK324,緊急脱出用取っ手無し,"取っ手追加
設変番号：B7-3",総組付,設計不良,2000/4/1,佐藤,2000/4/3,2000/4/4,2000/4/7,2000/4/8,,,,,総組付,設計不良,,第1組付課,5U00007,21644,KRP　0003,全固体電池実証機　プレス機,1,2000/4/3,QEE41,ZL1552,QE720
2024/10/30,東,,,"プレスst内、ロの字×ベースの組付けがボルトを
下から挿入しているのでやりにくいし、今以上
ベースが大きくなるなら届かない","ロの字フレームをサブベースに裏面固定、
サブベースはメインベースに上面締結
にします",SE,,2024/11/27,戸崎,2024/11/27,2025/1/14,2025/2/23,2025/2/25,,,,,SE,,,第1組付課,5U00007,21644,KRP　0003,全固体電池実証機　プレス機,21,2024/11/27,QEE41,ZL1552,QE720
2024/10/31,東,,,"↑と同じロの字、Assy化した時5t超える？
超えるなら場所かえないとホイスト使えない","ロの字フレーム、タイバー&キャップ、
サブベースで5t以下にします",SE,,2024/11/28,戸崎,2024/12/10,2025/1/14,2025/1/14,2025/1/14,,,,,SE,,,第1組付課,5U00007,21644,KRP　0003,全固体電池実証機　プレス機,29,2024/12/10,QEE41,ZL1552,QE720
2024/11/1,平野,HVB２３４,,"ユニットベースの位置決めピンの位置を
背面にして欲しい(ピンの抜き差しし難い)",変更します,SE,,2024/11/28,佐原,2025/2/5,2025/2/5,,2025/2/5,,,,,SE,,,第1組付課,5U00007,21644,KRP　0003,全固体電池実証機　プレス機,63,2025/2/5,QEE41,ZL1552,QE720
2024/11/2,平野,,QAA278-001,"以前のロールより重いので取付け/取外しが辛い
ガイド機構（ピン）を追加してほしい",ピン穴追加します,SE,,2024/11/15,佐原､石山,2024/12/4,2024/11/15,2024/12/4,2024/12/4,,,,,SE,,,第1組付課,5U00007,21644,KRP　0003,全固体電池実証機　プレス機,23,2024/12/4,QEE41,ZL1552,QE720
2024/11/3,平野,HVB234,HVB２３４-002,"取付ボルトのワッシャーが溶接ビードに
被らないか心配（6mm隙間あるので大丈夫かも）",設計ルール（No.G-83-007-A）上5ｍｍ以上確保のこととあるため現状のままにします,SE,,2024/11/28,佐原,2024/11/28,ー,,2024/11/28,,,,,SE,,,第1組付課,5U00007,21644,KRP　0003,全固体電池実証機　プレス機,19,2024/11/28,QEE41,ZL1552,QE720
2024/11/4,平野,QEA157,CAV６５２-003,"エッジセンサーゲージの表裏どっちでも組付く
（組付け方向限定した方が良いかな）",ボルトピッチを変更して組み付け方向を限定しました。,SE,,2025/3/10,佐原､石山,,,,2025/3/10,,,,,SE,,,第1組付課,5U00007,21644,KRP　0003,全固体電池実証機　プレス機,185,2025/7/28,QEE41,ZL1552,QE720
2024/11/5,平野,QEA157,CAV６５２-003,"・エッジセンサーゲージの取り付けを上から締めに　出来ないでしょうか。
・位置決めピンを着脱容易だけど精度◎に
変えてほしい。(セル組長辺裁断機で使ってたはず)",構造の都合で現状ままでお願いします。,SE,,,佐原､石山,,,,2024/11/5,,,,,SE,,,第1組付課,5U00007,21644,KRP　0003,全固体電池実証機　プレス機,184,2025/7/28,QEE41,ZL1552,QE720
2024/11/6,平野,QEA157,,エッジセンサーの左右方向の型はありますが、上下の型はフリーで良いですか？,上下はフリーのまま現状でお願いします。,SE,,2025/3/10,佐原､石山,,,,2025/3/10,,,,,SE,,,第1組付課,5U00007,21644,KRP　0003,全固体電池実証機　プレス機,183,2025/7/28,QEE41,ZL1552,QE720
2024/11/7,平野,QEA157,,↑スライダとセンサブラケットの位置決めも同様,上下はフリーのまま現状でお願いします。,SE,,2025/3/10,佐原､石山,,,,2025/3/10,,,,,SE,,,第1組付課,5U00007,21644,KRP　0003,全固体電池実証機　プレス機,182,2025/7/28,QEE41,ZL1552,QE720
2024/11/8,平野,QEA157,,プッシュクランパのハンドル干渉,紫ブラケットは廃止品のため干渉はありません,SE,,2025/3/10,佐原､石山,,,,2025/3/10,,,,,SE,,,第1組付課,5U00007,21644,KRP　0003,全固体電池実証機　プレス機,181,2025/7/28,QEE41,ZL1552,QE720
2024/11/9,平野,QAD175,,"ピンの位置をもう少し外にして欲しい
現状ピン抜きの一番太い所直径50㎜",変更します,SE,,2025/3/7,佐原､石山,2025/3/7,2025/3/7,,2025/3/7,,,,,SE,,,第1組付課,5U00007,21644,KRP　0003,全固体電池実証機　プレス機,79,2025/3/7,QEE41,ZL1552,QE720
2024/11/10,平野,QCD179,,↑同様,変更します,SE,,2025/3/7,佐原､石山,2025/3/7,2025/3/7,,2025/3/7,,,,,SE,,,第1組付課,5U00007,21644,KRP　0003,全固体電池実証機　プレス機,79,2025/3/7,QEE41,ZL1552,QE720
2024/11/11,平野,QEA158,,↑同様,変更します,SE,,2025/3/7,佐原,2025/3/7,2025/3/7,,2025/3/7,,,,,SE,,,第1組付課,5U00007,21644,KRP　0003,全固体電池実証機　プレス機,79,2025/3/7,QEE41,ZL1552,QE720
2024/11/12,平野,QEA157,,"ユニットベースへの位置決めはいらない？
再現性無い＋箔に対し斜めにCLがあたる恐れ",エッジセンサマスターゲージにより吸収予定,SE,,2025/3/7,佐原,2025/3/7,ー,,2025/3/7,,,,,SE,,,第1組付課,5U00007,21644,KRP　0003,全固体電池実証機　プレス機,78,2025/3/7,QEE41,ZL1552,QE720
2024/11/13,東,VGK245,6,"ジャバラ　ボルトがたるんだじゃばらで隠れて
締付けしにくいのでボルト位置をもっと外に
逃がしてほしい",部品発注済のため現状のままでお願いします。次回以降検討いたします。,SE,,2025/3/10,佐原､石山,,,,2025/3/10,,,,,SE,,,第1組付課,5U00007,21644,KRP　0003,全固体電池実証機　プレス機,178,2025/7/28,QEE41,ZL1552,QE720
2024/11/14,東,ACJ,,"油圧のエア抜きポートをタンクに接続して
楽に連続的にエア抜きできるようにしたい
（革新プレスを参考に）","設計に織込みます。
ZL1552-ASHに示しました。",SE,,2024/11/26,田中,2024/12/15,2025/2/6,,2025/2/6,,,,,SE,,,第1組付課,5U00007,21644,KRP　0003,全固体電池実証機　プレス機,22,2024/12/15,QEE41,ZL1552,QE720
2024/11/15,東,ZZL225,,"パワーマイスター後の油圧計が機外から見える
位置に変更してほしい","設計に織込みます
（エンジ課3D配線配管設計チームへ依頼）",SE,,2025/3/7,戸崎,2025/3/7,2025/3/7,,2025/3/7,,,,,SE,,,第1組付課,5U00007,21644,KRP　0003,全固体電池実証機　プレス機,75,2025/3/7,QEE41,ZL1552,QE720
2024/11/16,東,ZZL225,,"パワーマイスターに付いている上面のアイボルト
そこ吊穴に使っていいの？","今回のあつかんサーボでは、ポンプ等が載っている
ベース板側面のネジ穴をご使用下さい。",SE,,2025/2/6,田中,2025/2/6,ー,,2025/2/6,,,,,SE,,,第1組付課,5U00007,21644,KRP　0003,全固体電池実証機　プレス機,53,2025/2/6,QEE41,ZL1552,QE720
2024/11/17,東,HVB237,1,"組付け後の移設時、リフトのフォークをどこに
さすか検討必要（剛性・向き）",剛性確認実施します,SE,,2024/11/17,世古,2024/11/17,ー,,2024/11/17,,,,,SE,,,第1組付課,5U00007,21644,KRP　0003,全固体電池実証機　プレス機,0,2024/11/17,QEE41,ZL1552,QE720
2024/11/18,手柴,ZZL121,,"プレスロール台車を動かすのが大変。
アシスト等補助が欲しい","別途方法相談させて下さい。
（エンジ課治具設計チームへ依頼）",SE,,2025/3/7,戸崎,2025/3/7,ー,,2025/3/7,,,,,SE,,,第1組付課,5U00007,21644,KRP　0003,全固体電池実証機　プレス機,74,2025/3/7,QEE41,ZL1552,QE720
2024/11/19,手柴,ZZL121,,"プレスロール台車を上昇させるのが大変
高さ調整の範囲を少なく出来ないか","別途相談させて下さい。
（エンジ課治具設計チームへ依頼）
※加工精度＋ベース高さバラツキ＋床凹み考慮必要",SE,,2025/3/7,戸崎,2025/3/7,ー,,2025/3/7,,,,,SE,,,第1組付課,5U00007,21644,KRP　0003,全固体電池実証機　プレス機,73,2025/3/7,QEE41,ZL1552,QE720
2024/11/20,手柴,VGK,,"カバー取付取外し時、カバーを持ち支えている
カバー下に支える物が置けないか",大きいカバーは扉構造なので必要無し。,SE,,2025/3/7,下岡,2025/3/7,ー,,2025/3/10,,,,,SE,,,第1組付課,5U00007,21644,KRP　0003,全固体電池実証機　プレス機,72,2025/3/7,QEE41,ZL1552,QE720
2024/11/21,手柴,ZZL225,,"潤滑油流量調整弁を機外に出す
流量計は、調整弁から見える所に設置","設計に織込みます
（エンジ課3D配線配管設計チームへ依頼）",SE,,2025/3/7,早川,2025/3/7,2025/3/7,,2025/3/7,,,,,SE,,,第1組付課,5U00007,21644,KRP　0003,全固体電池実証機　プレス機,71,2025/3/7,QEE41,ZL1552,QE720
2024/11/22,手柴,ZZL226,,"潤滑油戻りモーターの排圧で壊れる
モーターの再選定若しくは、出入りモーターに
タイムラグを付ける",フィルタ位置を戻り側⇒吐出側に変更します。,SE,,2025/3/7,早川,2025/3/7,2025/3/7,,2025/3/7,,,,,SE,,,第1組付課,5U00007,21644,KRP　0003,全固体電池実証機　プレス機,70,2025/3/7,QEE41,ZL1552,QE720
2024/11/23,手柴,ZZL225,－０１９K,"潤滑継ぎ手同士が近すぎて締付しずらい
また、ホースも近くスパナが斜め掛けになる","カバーの隔壁部での密集
設計に織込みます
（エンジ課3D配線配管設計チームへ依頼）",SE,,2025/3/7,早川,2025/3/7,2025/3/7,,2025/3/7,,,,,SE,,,第1組付課,5U00007,21644,KRP　0003,全固体電池実証機　プレス機,69,2025/3/7,QEE41,ZL1552,QE720
2024/11/24,手柴,,,"ノックピンを抜かないとバラせない
精度的に余裕がある部品は、
ノックピンに押当るなどして位置決めにして欲しい",次回以降検討いたします。,SE,,2025/3/10,佐原､石山,,,,2025/3/10,,,,,SE,,,第1組付課,5U00007,21644,KRP　0003,全固体電池実証機　プレス機,170,2025/7/28,QEE41,ZL1552,QE720
2024/11/25,平野,ACB107 ,,"端部延伸スペーサーブロックをバラせなくなる
（位置決めピンが囲われてピン抜けない）","設計に織込みます。
(スペーサーブロックを無くします)",SE,,2024/11/26,田中,2024/11/26,2024/11/26,,2024/11/26,,,,,SE,,,第1組付課,5U00007,21644,KRP　0003,全固体電池実証機　プレス機,2,2024/11/26,QEE41,ZL1552,QE720
2024/11/26,平野,EPS,,上ローラーユニットのLMへの位置決めは不要ですか？,"設計に織込みます。
(位置決めピンに当て位置決めします)",SE,,2024/11/26,田中,2024/11/26,2024/11/26,,2024/11/26,,,,,SE,,,第1組付課,5U00007,21644,KRP　0003,全固体電池実証機　プレス機,1,2024/11/26,QEE41,ZL1552,QE720
2024/11/27,東,,,"油圧シリンダーのエア抜き時、油かこぼれるし見えない所だから時間がかかる。
革新と同じくエア抜きポートから油圧タンクにかえす
配管をつなぎたい","設計に織込みます。
ZL1552-ASHに示しました。",SE,,2024/11/26,田中,2024/12/15,2025/2/6,,2025/2/6,,,,,SE,,,第1組付課,5U00007,21644,KRP　0003,全固体電池実証機　プレス機,13,2024/12/15,QEE41,ZL1552,QE720
2024/11/28,東,,,"NN/NNU現合
ガタ測定が傾き側にシビアなので革新のように
ｱｳﾀｰを肩当てしてやりたい","別途相談させて下さい。
（エンジ課治具設計チームへ依頼）",SE,,2025/3/7,戸崎,2025/3/7,2025/3/7,,2025/3/7,,,,,SE,,,第1組付課,5U00007,21644,KRP　0003,全固体電池実証機　プレス機,66,2025/3/7,QEE41,ZL1552,QE720
2024/11/29,東,,,"端部延伸下ローラー交換用治具必要
（重くて人力は不可）","引出し後の搭載治具を準備します。
※電製確認&オーダー発行後",SE,,2024/11/26,田中,2025/2/28,,,,,,,,SE,,中,第1組付課,5U00007,21644,KRP　0003,全固体電池実証機　プレス機,60,2025/2/28,QEE41,ZL1552,QE720
2024/11/30,東,EPS,ACB107-010,"設備×EPS下ロールの固定、
ピンが後から入れれないし抜けない（モーター側）
ピン以外の位置決め方法にしてほしい","設計に織込みます。
(ピンに当てる構造に変更します)",SE,,2024/11/26,田中,2024/11/26,2024/11/26,,2025/3/7,,,,,SE,,,第1組付課,5U00007,21644,KRP　0003,全固体電池実証機　プレス機,-4,2024/11/26,QEE41,ZL1552,QE720
2024/12/1,手柴,,,現設備は、設備配列と操作盤の表示（操作）位置が同じでない。,"？
（制御へ依頼）",SE,,2025/3/7,浦上､戸崎,,,,2025/3/7,,,,,SE,,,第1組付課,5U00007,21644,KRP　0003,全固体電池実証機　プレス機,165,2025/7/28,QEE41,ZL1552,QE720
2024/12/2,東,,QAD175-004,"ニップ用シリンダー付近のカバーは交換に備えてスキマを大きくとるか、
カバーが外せるようにしておいてほしい。
オートSWやスピコンの再調整時にもそうなっていてほしい",カバー部をボルト止めにします。,SE,,2025/3/7,佐原､下岡,2025/3/7,,,2025/3/7,,,,,SE,,,第1組付課,5U00007,21644,KRP　0003,全固体電池実証機　プレス機,64,2025/3/7,QEE41,ZL1552,QE720
2024/12/3,東,,"HVB235-001
とか","一番下にくる板弱そうだけどリフトですくって
変形しない？？",弾性変形範囲内に収まるよう解析済です,SE,,2024/11/21,佐原､早川,2024/11/21,2024/11/21,,2024/11/21,,,,,SE,,,第1組付課,5U00007,21644,KRP　0003,全固体電池実証機　プレス機,-9,2024/11/21,QEE41,ZL1552,QE720
2024/12/4,東,,銘板,"機器パネルとかは銘板を貼るスペースも確保した大きさにしてほしい
※銘板はテプラ？？","銘板サイズ決めて、
エンジ課3D配線配管設計チームへ依頼？",SE,,2025/3/7,浦上､戸崎,2025/3/7,ー,,2025/3/7,,,,,SE,,,第1組付課,5U00007,21644,KRP　0003,全固体電池実証機　プレス機,62,2025/3/7,QEE41,ZL1552,QE720
2024/12/5,東,,ラック,"どこでやるかにもよるが、忘れずラックや柱も
発注かけてください",エンジ課3D配線配管設計チームへ依頼,SE,,2025/3/7,浦上､戸崎,,,,2024/12/5,,,,,SE,,,第1組付課,5U00007,21644,KRP　0003,全固体電池実証機　プレス機,162,2025/7/28,QEE41,ZL1552,QE720
,手柴,,,"操作盤数値設定の小数点以下の桁を
出来るだけ合わせて","？
（制御へ依頼）",SE,,2025/3/7,浦上､戸崎,,,,2024/12/5,,,,,SE,,,,,,,,,,,,
2024/11/15,平野,,箔切断治具,刃の方は位置決めピンがあるが、箔継台の方に位置決めが無い。,追加します,SE,,2025/3/7,佐原,2025/3/7,2025/3/7,,2025/3/7,,,,,SE,,,第1組付課,5U00007,21644,KRP　0003,全固体電池実証機　プレス機,75,2025/3/7,QEE41,ZL1552,QE720
2024/11/15,平野,,HVB２３４-004K,"エアブラケットにPETの接触防止カバーが欲しい。
グロボ作業時、足をぶつけそう。","しゃがみ作業を想定していないためこのままとします。
実際ぶつけることが何度か発生するようでしたら改造対応します。",SE,,2025/3/21,佐原,2025/3/21,2025/3/21,,2025/3/21,,,,,SE,,,第1組付課,5U00007,21644,KRP　0003,全固体電池実証機　プレス機,85,2025/3/21,QEE41,ZL1552,QE720
2024/11/15,平野,,中間搬送,上ローラーの交換時、下ローラーを外さないとピンが抜けない。肩当てでも良ければ嬉しい。,"設計に織込みます。
(片側肩当てに変更致します)",SE,,2024/11/26,田中,2024/11/29,2025/2/6,,2025/2/6,,,,,SE,,,第1組付課,5U00007,21644,KRP　0003,全固体電池実証機　プレス機,11,2024/11/29,QEE41,ZL1552,QE720
2024/11/15,平野,,中間搬送,↑現状の図面だとピン抜けない構造。,"設計に織込みます。
(片側肩当てに変更致します)",SE,,2024/11/26,田中,2024/11/29,2025/2/6,,2025/2/6,,,,,SE,,,第1組付課,5U00007,21644,KRP　0003,全固体電池実証機　プレス機,11,2024/11/29,QEE41,ZL1552,QE720
2024/11/21,平野,,ユニットベース,全stユニットベースのフレノリンクの位置が遠い,位置変更します,SE,,2024/11/21,佐原,2024/11/29,2024/11/29,,2024/11/29,,,,,SE,,,第1組付課,5U00007,21644,KRP　0003,全固体電池実証機　プレス機,7,2024/11/29,QEE41,ZL1552,QE720
2024/11/21,平野,,ユニットベース,全stユニットベースの反転用のフレノリンクを下側にも欲しい,追加します,SE,,2024/11/21,佐原,2024/11/29,2024/11/29,,2024/11/29,,,,,SE,,,第1組付課,5U00007,21644,KRP　0003,全固体電池実証機　プレス機,7,2024/11/29,QEE41,ZL1552,QE720
2024/11/22,東,HVB233-239,HVB237-002,真ん中のジャッキボルト手が届かず締められない,"設計へ織込みます
（ジャッキボルト位置変更）",SE,,2024/11/26,早川,2024/12/20,2024/12/20,,2024/12/20,,,,,SE,,,第1組付課,5U00007,21644,KRP　0003,全固体電池実証機　プレス機,21,2024/12/20,QEE41,ZL1552,QE720
